{
  "lesson_id": "L08",
  "task_id": "AIM-021",
  "title_en": "My Home & My City",
  "title_ar": "منزلي ومدينتي",
  "week": 2,
  "difficulty": 2,
  "sprint": "Sprint 4 - Content",
  "prerequisites": ["L04"],
  "skills_covered": ["SK-V06", "SK-G01", "SK-G02"],
  "learning_objectives": [
    "Name rooms and places in a home (bedroom, kitchen, living room, bathroom).",
    "Name common city places (school, hospital, market, park, mosque).",
    "Use 'there is / there are' to describe a place.",
    "Use prepositions of place: in, on, next to, near."
  ],
  "questions": [
    {
      "question_id": "L08-Q01",
      "skill_id": "SK-V06",
      "concept": "home_rooms_vocabulary",
      "difficulty": 1,
      "type": "mcq",
      "prompt_en": "Where do you cook food?",
      "prompt_ar": "أين تطبخ الطعام؟",
      "choices": ["In the kitchen", "In the bedroom", "In the bathroom", "In the garden"],
      "correct_answer": "In the kitchen",
      "explanation_en": "We cook in the kitchen. Kitchen = مطبخ.",
      "explanation_ar": "نطبخ الطعام في المطبخ. kitchen = مطبخ.",
      "common_error_tags": [],
      "prerequisites": [],
      "hints": ["المطبخ = kitchen"]
    },
    {
      "question_id": "L08-Q02",
      "skill_id": "SK-V06",
      "concept": "city_places_vocabulary",
      "difficulty": 1,
      "type": "mcq",
      "prompt_en": "You go to a ___ when you are sick.",
      "prompt_ar": "تذهب إلى ___ عندما تكون مريضاً.",
      "choices": ["hospital", "school", "market", "park"],
      "correct_answer": "hospital",
      "explanation_en": "A hospital is where you go when you are sick or injured. Hospital = مستشفى.",
      "explanation_ar": "المستشفى هو المكان الذي تذهب إليه عند المرض. hospital = مستشفى.",
      "common_error_tags": [],
      "prerequisites": [],
      "hints": ["مستشفى = hospital"]
    },
    {
      "question_id": "L08-Q03",
      "skill_id": "SK-G02",
      "concept": "there_is_there_are",
      "difficulty": 2,
      "type": "mcq",
      "prompt_en": "___ a park near my house.",
      "prompt_ar": "___ حديقة بالقرب من منزلي.",
      "choices": ["There is", "There are", "It is", "They are"],
      "correct_answer": "There is",
      "explanation_en": "'Park' is singular, so we use 'There is'. There are = for plural.",
      "explanation_ar": "'Park' مفرد، لذا نستخدم 'There is'. There are = للجمع.",
      "common_error_tags": ["there_is_are_confusion"],
      "prerequisites": [],
      "hints": ["مفرد → There is", "جمع → There are"]
    },
    {
      "question_id": "L08-Q04",
      "skill_id": "SK-V06",
      "concept": "prepositions_of_place",
      "difficulty": 2,
      "type": "mcq",
      "prompt_en": "The school is ___ the hospital. (جانب المستشفى)",
      "prompt_ar": "المدرسة ___ المستشفى.",
      "choices": ["next to", "in", "on", "at"],
      "correct_answer": "next to",
      "explanation_en": "'Next to' means beside or at the side of something.",
      "explanation_ar": "'Next to' تعني بجانب شيء ما.",
      "common_error_tags": ["preposition_error"],
      "prerequisites": [],
      "hints": ["next to = بجانب", "in = داخل", "on = على"]
    },
    {
      "question_id": "L08-Q05",
      "skill_id": "SK-G02",
      "concept": "there_are_plural",
      "difficulty": 2,
      "type": "fill",
      "prompt_en": "___ three bedrooms in my house.",
      "prompt_ar": "___ ثلاث غرف نوم في منزلي.",
      "correct_answer": "There are",
      "explanation_en": "'Three bedrooms' is plural, so we use 'There are'.",
      "explanation_ar": "'Three bedrooms' جمع، لذا نستخدم 'There are'.",
      "common_error_tags": ["there_is_are_confusion"],
      "prerequisites": [],
      "hints": ["three = جمع → There are"]
    }
  ]
}
