{
  "lesson_id": "L10",
  "task_id": "AIM-021",
  "title_en": "Review & Post-Test",
  "title_ar": "مراجعة واختبار ختامي",
  "week": 2,
  "difficulty": 2,
  "sprint": "Sprint 4 - Content",
  "prerequisites": ["L01", "L02", "L03", "L04", "L05", "L06", "L07", "L08", "L09"],
  "skills_covered": ["SK-G01", "SK-G02", "SK-G04", "SK-V01", "SK-V04", "SK-V05", "SK-R01"],
  "learning_objectives": [
    "Review all key grammar points from 2 weeks.",
    "Review all key vocabulary from 2 weeks.",
    "Complete the post-test to measure learning gain.",
    "Build learner confidence before the end of pilot."
  ],
  "questions": [
    {
      "question_id": "L10-Q01",
      "skill_id": "SK-G01",
      "concept": "to_be_review",
      "difficulty": 2,
      "type": "mcq",
      "prompt_en": "My parents ___ from Saudi Arabia.",
      "prompt_ar": "والديّ ___ من المملكة العربية السعودية.",
      "choices": ["are", "is", "am", "be"],
      "correct_answer": "are",
      "explanation_en": "'My parents' = plural → are.",
      "explanation_ar": "'My parents' = جمع → are.",
      "common_error_tags": ["confusion_am_is_are"],
      "prerequisites": [],
      "hints": ["parents = جمع → are"]
    },
    {
      "question_id": "L10-Q02",
      "skill_id": "SK-G02",
      "concept": "present_simple_review",
      "difficulty": 2,
      "type": "fill",
      "prompt_en": "My father ___ to work at 7 AM. (go)",
      "prompt_ar": "أبي ___ إلى العمل الساعة السابعة. (go)",
      "correct_answer": "goes",
      "explanation_en": "'My father' = he → goes (go + es).",
      "explanation_ar": "'My father' = هو → goes (go + es).",
      "common_error_tags": ["wrong_verb_form", "third_person_s_confusion"],
      "prerequisites": [],
      "hints": ["he → goes (go ينتهي بـ o → أضف es)"]
    },
    {
      "question_id": "L10-Q03",
      "skill_id": "SK-G04",
      "concept": "question_formation_review",
      "difficulty": 3,
      "type": "mcq",
      "prompt_en": "___ she live near your house?",
      "prompt_ar": "___ هي تسكن قريباً من منزلك؟",
      "choices": ["Does", "Do", "Is", "Are"],
      "correct_answer": "Does",
      "explanation_en": "'She' = third person singular → Does.",
      "explanation_ar": "'She' = مفرد غائب مؤنث → Does.",
      "common_error_tags": ["do_does_confusion"],
      "prerequisites": [],
      "hints": ["she → Does"]
    },
    {
      "question_id": "L10-Q04",
      "skill_id": "SK-V04",
      "concept": "family_vocabulary_review",
      "difficulty": 1,
      "type": "mcq",
      "prompt_en": "Your mother's sister is your ___.",
      "prompt_ar": "أخت أمك هي ___.",
      "choices": ["aunt", "cousin", "grandmother", "niece"],
      "correct_answer": "aunt",
      "explanation_en": "The sister of your mother or father is your aunt. (عمّة / خالة)",
      "explanation_ar": "أخت أمك أو أبيك تُسمى 'aunt' بالإنجليزية.",
      "common_error_tags": ["family_term_confusion"],
      "prerequisites": [],
      "hints": ["عمّة / خالة = aunt"]
    },
    {
      "question_id": "L10-Q05",
      "skill_id": "SK-R01",
      "concept": "reading_review",
      "difficulty": 2,
      "type": "mcq",
      "prompt_en": "Read: 'Layla is 19 years old. She studies English at university.' — How old is Layla?",
      "prompt_ar": "اقرأ: 'Layla is 19 years old. She studies English at university.' كم عمر ليلى؟",
      "choices": ["19 years old", "20 years old", "18 years old", "21 years old"],
      "correct_answer": "19 years old",
      "explanation_en": "The text says 'Layla is 19 years old.'",
      "explanation_ar": "النص يقول 'Layla is 19 years old.' أي عمرها 19 سنة.",
      "common_error_tags": ["reading_comprehension_error"],
      "prerequisites": [],
      "hints": ["ابحث عن 'years old' في النص."]
    }
  ]
}
