{
  "lesson_id": "L03",
  "task_id": "AIM-021",
  "title_en": "Numbers & Colors",
  "title_ar": "الأرقام والألوان",
  "week": 1,
  "difficulty": 1,
  "sprint": "Sprint 4 - Content",
  "prerequisites": ["L02"],
  "skills_covered": ["SK-V02", "SK-V03"],
  "learning_objectives": [
    "Count and say numbers 1–20 in English.",
    "Name at least 8 basic colors in English.",
    "Use numbers and colors in simple sentences with 'to be'."
  ],
  "questions": [
    {
      "question_id": "L03-Q01",
      "skill_id": "SK-V02",
      "concept": "numbers_1_10",
      "difficulty": 1,
      "type": "mcq",
      "prompt_en": "How do you write the number 7 in English?",
      "prompt_ar": "كيف تكتب الرقم 7 بالإنجليزية؟",
      "choices": ["Seven", "Sefen", "Saven", "Sevun"],
      "correct_answer": "Seven",
      "explanation_en": "The number 7 is written as 'seven' in English.",
      "explanation_ar": "الرقم 7 يُكتب 'seven' بالإنجليزية.",
      "common_error_tags": ["spelling_error"],
      "prerequisites": [],
      "hints": ["Seven = سبعة"]
    },
    {
      "question_id": "L03-Q02",
      "skill_id": "SK-V02",
      "concept": "numbers_11_20",
      "difficulty": 2,
      "type": "mcq",
      "prompt_en": "What is the English word for the number 15?",
      "prompt_ar": "ما الكلمة الإنجليزية للرقم 15؟",
      "choices": ["Fifteen", "Fiveteen", "Fifty", "Fiften"],
      "correct_answer": "Fifteen",
      "explanation_en": "Numbers 13–19 end in '-teen': thirteen, fourteen, fifteen...",
      "explanation_ar": "الأرقام من 13 إلى 19 تنتهي بـ '-teen': thirteen, fourteen, fifteen...",
      "common_error_tags": ["spelling_error", "false_cognate_arabic"],
      "prerequisites": [],
      "hints": ["15 = خمسة عشر = Fifteen", "ليس Fifty (50)"]
    },
    {
      "question_id": "L03-Q03",
      "skill_id": "SK-V03",
      "concept": "basic_colors",
      "difficulty": 1,
      "type": "mcq",
      "prompt_en": "The sky is ___.",
      "prompt_ar": "السماء ___.",
      "choices": ["blue", "red", "green", "yellow"],
      "correct_answer": "blue",
      "explanation_en": "The sky is typically blue. Blue = أزرق.",
      "explanation_ar": "لون السماء عادةً أزرق. blue = أزرق.",
      "common_error_tags": [],
      "prerequisites": [],
      "hints": ["السماء = Sky", "أزرق = blue"]
    },
    {
      "question_id": "L03-Q04",
      "skill_id": "SK-V03",
      "concept": "colors_sentence",
      "difficulty": 1,
      "type": "mcq",
      "prompt_en": "My car is ___. (The car is the color of fire trucks.)",
      "prompt_ar": "سيارتي ___. (السيارة بلون سيارات الإطفاء.)",
      "choices": ["red", "blue", "black", "white"],
      "correct_answer": "red",
      "explanation_en": "Fire trucks are red. Red = أحمر.",
      "explanation_ar": "سيارات الإطفاء حمراء. red = أحمر.",
      "common_error_tags": [],
      "prerequisites": [],
      "hints": ["أحمر = red"]
    },
    {
      "question_id": "L03-Q05",
      "skill_id": "SK-V02",
      "concept": "number_sentence_with_to_be",
      "difficulty": 2,
      "type": "fill",
      "prompt_en": "I have ___ books. (٣)",
      "prompt_ar": "عندي ___ كتب. (٣)",
      "correct_answer": "three",
      "explanation_en": "The number 3 in English is 'three'.",
      "explanation_ar": "الرقم 3 بالإنجليزية هو 'three'.",
      "common_error_tags": ["spelling_error"],
      "prerequisites": [],
      "hints": ["3 = three"]
    }
  ]
}
